{
  "$schema": "contracts/rulebook.schema.json",
  "schemaVersion": 2,
  "repository": "zkzeroxvirus/MTGR-Rules",
  "branch": "main",
  "title": "MTG Roguelite Rules",
  "description": "Stable rule contracts for MTGR consumers. Canonical gameplay wording lives in dedicated Markdown units under rules/; generated compilations provide continuous player and Host reading.",
  "documents": [
    {
      "id": "full-rulebook",
      "title": "Complete Rulebook",
      "source": "RULEBOOK.md",
      "audience": [
        "player",
        "host"
      ]
    },
    {
      "id": "player-reference",
      "title": "Player Reference",
      "source": "generated/PLAYER-REFERENCE.md",
      "audience": [
        "player"
      ]
    },
    {
      "id": "host-reference",
      "title": "Host Reference",
      "source": "generated/HOST-REFERENCE.md",
      "audience": [
        "host"
      ]
    }
  ],
  "learnPath": [
    {
      "id": "before-run",
      "number": "01",
      "title": "Before the Run",
      "description": "Understand the party, build a legal run deck, and finish pre-encounter setup.",
      "rules": [
        "game-overview",
        "player-quick-start",
        "host-run-procedure",
        "host-role-table-philosophy",
        "player-structure",
        "deckbuilding",
        "deck-minimum",
        "combo-restrictions",
        "banned-restricted",
        "pre-encounter-setup",
        "run-structure",
        "trinket-system",
        "global-limits"
      ]
    },
    {
      "id": "encounter-loop",
      "number": "02",
      "title": "The Encounter Loop",
      "description": "Resolve an encounter, determine victory or loss, and move into the post-encounter decision.",
      "rules": [
        "game-loop",
        "party-combat-interactions",
        "encounter-flow",
        "failed-encounter",
        "reward-timing",
        "death-rules"
      ]
    },
    {
      "id": "between-encounters",
      "number": "03",
      "title": "Between Encounters",
      "description": "Resolve Town or Stay Out before the next encounter; Town is mandatory before the Crypt.",
      "rules": [
        "town-flow",
        "stay-out-flow",
        "event-resolution",
        "travelers-system",
        "wanderers-system",
        "event-timing",
        "event-frequency"
      ]
    },
    {
      "id": "crypt",
      "number": "04",
      "title": "The Crypt",
      "description": "Reach the final boss, apply Crypt-specific rules, and resolve the run result.",
      "rules": [
        "crypt",
        "run-success",
        "run-failure"
      ]
    },
    {
      "id": "between-runs",
      "number": "05",
      "title": "Between Runs",
      "description": "Understand persistent progression and what follows players into future runs.",
      "rules": [
        "host-types-profiles",
        "progression-reference",
        "progression-shop",
        "brands-system",
        "progression-slot-rules"
      ]
    },
    {
      "id": "seasonal-events",
      "number": "06",
      "title": "Seasonal Events",
      "description": "Find themed Event content and rewards.",
      "rules": [
        "seasonal-events",
        "harvest-moon-overview",
        "high-tide-hijinks-overview"
      ]
    }
  ],
  "guides": [
    {
      "id": "encounter-won",
      "title": "We won an encounter",
      "description": "Resolve victory cleanly and continue the run.",
      "steps": [
        {
          "label": "Resolve XP, Cashout, and Loot Pool",
          "rule": "reward-timing"
        },
        {
          "label": "Choose Town or Stay Out; Town is mandatory before the Crypt",
          "rule": "post-encounter-choice"
        },
        {
          "label": "Resolve the selected path",
          "choices": [
            "town-flow",
            "stay-out-flow"
          ]
        },
        {
          "label": "Resolve Event(s), then begin the next encounter",
          "rule": "event-resolution"
        }
      ]
    },
    {
      "id": "encounter-lost",
      "title": "We lost an encounter",
      "description": "Apply the failed-encounter transition without ending the run.",
      "steps": [
        {
          "label": "Skip encounter rewards",
          "rule": "failed-encounter"
        },
        {
          "label": "Choose Town or Stay Out; Town is mandatory before the Crypt",
          "rule": "post-encounter-choice"
        },
        {
          "label": "Resolve the selected path",
          "choices": [
            "town-flow",
            "stay-out-flow"
          ]
        },
        {
          "label": "Continue normal Event resolution",
          "rule": "event-resolution"
        }
      ]
    },
    {
      "id": "going-to-town",
      "title": "We chose Town",
      "description": "Walk through a Town visit in order.",
      "steps": [
        {
          "label": "Fully heal all players",
          "rule": "town-flow"
        },
        {
          "label": "Use Town buildings",
          "rule": "town-buildings"
        },
        {
          "label": "Proceed to Event resolution",
          "rule": "event-resolution"
        }
      ]
    },
    {
      "id": "staying-out",
      "title": "We chose Stay Out",
      "description": "Resolve the higher-variance path in order.",
      "steps": [
        {
          "label": "Gain Stay Out XP: 10 XP, +5 for each consecutive Stay Out",
          "rule": "stay-out-flow"
        },
        {
          "label": "Gain 2 Mystery Packs per player",
          "rule": "stay-out-flow"
        },
        {
          "label": "Resolve a Supply Drop and Wanderer",
          "rule": "stay-out-flow"
        },
        {
          "label": "Resolve Events: 2, +1 for each consecutive Stay Out",
          "rule": "event-resolution"
        }
      ]
    },
    {
      "id": "host-setup",
      "title": "Set up Host scaling",
      "description": "Find the Host scaling layers that apply at the start of an encounter.",
      "steps": [
        {
          "label": "Determine Authority level",
          "rule": "authority-level"
        },
        {
          "label": "Set up Doom cards",
          "rule": "doom-setup"
        },
        {
          "label": "Apply always-on scaling powers",
          "rule": "always-on-scaling"
        },
        {
          "label": "Apply encounter Affixes",
          "rule": "affixes-reference"
        }
      ]
    }
  ],
  "rules": [
    {
      "id": "game-overview",
      "title": "Game Overview",
      "source": "rules/getting-started/game-overview.md",
      "phase": "before-run",
      "audience": [
        "player",
        "host"
      ],
      "aliases": [
        "what is mtgr",
        "objective overview",
        "commander roguelite",
        "commander roguelike"
      ],
      "related": [
        "run-structure",
        "game-loop",
        "reward-timing",
        "town-flow",
        "stay-out-flow",
        "crypt"
      ],
      "content": {
        "kind": "document"
      }
    },
    {
      "id": "player-quick-start",
      "title": "Player Quick Start",
      "source": "rules/getting-started/player-quick-start.md",
      "phase": "before-run",
      "audience": [
        "player"
      ],
      "aliases": [
        "how to play",
        "player setup",
        "start token",
        "ready token"
      ],
      "related": [
        "deckbuilding",
        "pre-encounter-setup",
        "game-loop",
        "run-end-essence-rewards"
      ],
      "content": {
        "kind": "document"
      }
    },
    {
      "id": "host-run-procedure",
      "title": "Host Run Procedure",
      "source": "rules/host/host-run-procedure.md",
      "phase": "before-run",
      "audience": [
        "host"
      ],
      "aliases": [
        "how to host",
        "host setup",
        "host flow",
        "run procedure"
      ],
      "related": [
        "host-role-table-philosophy",
        "encounter-flow",
        "reward-timing",
        "town-flow",
        "stay-out-flow",
        "crypt"
      ],
      "content": {
        "kind": "document"
      }
    },
    {
      "id": "host-types-profiles",
      "title": "Host Types and Progression Profiles",
      "source": "rules/host/host-types-profiles.md",
      "phase": "between-runs",
      "audience": [
        "player",
        "host"
      ],
      "aliases": [
        "verified host",
        "regular host",
        "profiles",
        "verified progression"
      ],
      "related": [
        "progression-reference"
      ],
      "content": {
        "kind": "document"
      }
    },
    {
      "id": "host-role-table-philosophy",
      "title": "Host Role and Table Philosophy",
      "source": "rules/host/host-role-table-philosophy.md",
      "phase": "before-run",
      "audience": [
        "player",
        "host"
      ],
      "aliases": [
        "host expectations",
        "host role",
        "table philosophy",
        "good faith adjudication",
        "base and custom play"
      ],
      "related": [
        "game-overview",
        "host-types-profiles",
        "town-buildings"
      ],
      "content": {
        "kind": "document"
      }
    },
    {
      "id": "player-structure",
      "title": "Player Structure",
      "source": "rules/getting-started/player-structure.md",
      "phase": "before-run",
      "audience": [
        "player",
        "host"
      ],
      "aliases": [
        "party",
        "host controls encounters",
        "cooperative"
      ],
      "related": [
        "turn-structure",
        "party-combat-interactions"
      ],
      "content": {
        "kind": "document"
      }
    },
    {
      "id": "player-health",
      "title": "Player Health, Healing, and Max HP",
      "source": "rules/encounters/player-health.md",
      "phase": "encounter-loop",
      "audience": [
        "player",
        "host"
      ],
      "aliases": [
        "health",
        "heal",
        "max hp",